{
  "schema": "rbot.classroom.ping.v1",
  "kind": "ping",
  "id": "PING-20260926T183308Z-0004-ZYZ0",
  "at": "2026-09-26T18:33:08Z",
  "from": {
    "rid": "ЯID-0001-3QQS",
    "name": "Rizal"
  },
  "to": {
    "rid": "ЯID-0004-ZYZ0",
    "name": "ЯBAT"
  },
  "asked_as": "ЯBAT",
  "rfid": null,
  "via": "cli",
  "note": "Decider Grok Bot session live classroom 2026-09-26"
}
