{
  "schema": "rbot.classroom.ping.v1",
  "kind": "ping",
  "id": "PING-20260926T183304Z-0003-P4M6",
  "at": "2026-09-26T18:33:04Z",
  "from": {
    "rid": "ЯID-0004-ZYZ0",
    "name": "ЯBAT"
  },
  "to": {
    "rid": "ЯID-0003-P4M6",
    "name": "ЯMAX"
  },
  "asked_as": "ЯMAX",
  "rfid": null,
  "via": "cli",
  "note": "Decider Grok Bot session live classroom 2026-09-26"
}
