{
  "schema": "rbot.classroom.ping.v1",
  "kind": "pong",
  "id": "PONG-20260926T183323Z-0004-ZYZ0",
  "at": "2026-09-26T18:33:23Z",
  "from": {
    "rid": "ЯID-0004-ZYZ0",
    "name": "ЯBAT"
  },
  "to": {
    "rid": "ЯID-0001-3QQS",
    "name": "Rizal"
  },
  "rfid": null,
  "in_reply_to": "PING-20260926T183308Z-0004-ZYZ0",
  "mode": "online",
  "via": "cli",
  "runner": {
    "rid": "ЯID-0004-ZYZ0",
    "name": "ЯBAT"
  },
  "runner_basis": "self-reported",
  "surface": "agent-box",
  "note": "Decider Grok Bot session live classroom 2026-09-26 · on location"
}
