{
  "schema": "rbot.classroom.ping.v1",
  "kind": "ping",
  "id": "PING-20260926T183303Z-0002-PQ2Q",
  "at": "2026-09-26T18:33:03Z",
  "from": {
    "rid": "ЯID-0004-ZYZ0",
    "name": "ЯBAT"
  },
  "to": {
    "rid": "ЯID-0002-PQ2Q",
    "name": "ЯBOT"
  },
  "asked_as": "ЯBOT",
  "rfid": null,
  "via": "cli",
  "note": "Decider Grok Bot session live classroom 2026-09-26"
}
